Content,Date,Title,Newspaper
ロシアの侵略を一日も早く終わらせ、ウクライナの復興を進めることは国際社会全体の責務だ。ウクライナ軍の反転攻勢は、その試金石となる。結束して支援したい。ウクライナの反攻は６月上旬から、ロシアが占領する南部と東部の領土奪還を目指して始まった。作戦はまだ初期段階だが、ゼレンスキー大統領はこれまでの進展について、「我々が望んでいたより遅い」と述べた。露軍が防衛のために敷設した地雷原によって前進が妨げられているという。欧米がウクライナに供与した戦車や歩兵戦闘車も損害を受けたとみられている。米国は戦闘車両の追加供与を表明した。領土奪還の戦いは、相手の地雷原や塹壕（ざんごう）を突破する必要があるため、領土防衛よりも、兵員の犠牲や装備の損失が多くなるのは避けられない。成果を上げるのにも時間がかかる。各国は長期戦を覚悟で支援を続けねばならない。最大の焦点は南部ザポリージャ州の攻防だ。この地域は、ロシアが一方的に実効支配しているウクライナのクリミア半島と、ロシア本土を結ぶ要衝となっている。ウクライナ軍が拠点都市のメリトポリなどを奪還できれば、ロシアからクリミアへの燃料や弾薬などの補給路が断たれ、ロシア軍の兵站（へいたん）は厳しい状況に追い込まれる。ウクライナから露軍を撤収させる契機になるとされる。ウクライナ南部カホフカ水力発電所のダム決壊は下流域に大洪水を起こし、東京２３区の面積に匹敵する広範な地域が水没した。戦況への影響に加え、農業や生態系、自然環境にも長期かつ壊滅的な打撃を与えると指摘されている。当面の急務は、洪水で家を失った人々への支援だが、この地域を支配しているロシアは、国連スタッフなどの立ち入りを認めていない。非人道的な対応には、強い憤りを覚える。ウクライナは戦時下にあるが、多くの人々は日常生活を送り、ロシアに攻撃された施設や住居の復旧作業を進めている。軍事支援だけでなく、中長期的な復興支援も極めて重要だ。英国では、６１か国の政府や民間企業の代表が参加し、ウクライナ復興を議論する国際会議が開かれた。各国から８兆５０００億円規模の拠出表明があったという。将来の展望を示すことは、ウクライナの人々を勇気づけるはずだ。日本は、がれき除去や地雷処理、交通インフラの再建などで中心的な役割を果たしたい。,2023-06-25 00:00:00,ウクライナ情勢復興見据えて反攻を支えたい,yomiuri
リニア中央新幹線の一部工事が停滞している現状は見過ごせない。建設主体のＪＲ東海は科学的な根拠に基づく対策を講じ、自治体や住民の理解を早急に得るべきだ。リニア中央新幹線は、超電導の技術を用いて、東京・品川―大阪間の４３８キロ・メートルを１時間強で結ぶ構想だ。ＪＲ東海は、２０３７年の開業を目指している。政府は、全線開通による年間の経済効果を６・５兆円と見込んでいる。災害時には、東海道新幹線のバイパスの機能を果たす役割も期待されよう。このうち品川―名古屋間は２７年の開業を目指し、１４年末に工事が始まった。だが、静岡県側の南アルプスを貫くトンネル工事は、県の認可が得られていない。静岡県の川勝平太知事は、トンネルの新設により、南アルプスの山々に蓄えられた水が流れ出し、県民の生活用水である大井川の水量が減る、と訴え続けている。わき水をすべて大井川に戻す方法が確立されない限り、工事を認めない考えだ。ＪＲ東海は、トンネル開通後に出た水について、全てポンプでくみ上げ、大井川に戻す方針だ。さらに、工事期間中に川に戻すことが困難な水に関しても、大井川上流の田代ダムから供給する案を提示し、今月からはダムを管理する企業と協議を始めた。田代ダムの活用にめどがつけば、大井川の水をすべて川に戻す、という川勝氏が掲げていた条件は満たされる形になる。大井川流域の１０市町は概（おおむ）ね、田代ダムの活用案を歓迎している。リニアの工事に伴うインフラ整備に期待している面もあるのだろう。川勝氏は、流域の自治体とも十分に協議してもらいたい。静岡県内の着工に向けては、なおクリアすべき課題がある。トンネルの掘削で発生する大量の土をどう処理するかで、ＪＲ東海と県の議論は進んでいない。ＪＲ側は南アルプス山中に土の置き場を設ける予定だが、川勝氏は、地盤の脆（もろ）い場所があり、崩落が起きかねないと反発している。地元の不安を解消するには、科学的な知見に基づく対策が不可欠だ。ＪＲ東海は、自治体や地元住民の理解を得られるよう、丁寧な説明に努めねばならない。リニア中央新幹線は総事業費９兆円のプロジェクトで、このうち３兆円は国の財政投融資が充てられる。政府はＪＲ東海と静岡県の対話が円滑に進むよう、後押しする必要がある。,2023-06-25 00:00:00,リニア工事停滞科学的知見もとに前進目指せ,yomiuri
多くの住民を巻き込んだ凄惨（せいさん）な戦争を、二度と起こしてはならない。沖縄の苦難の歴史を胸に刻み、平和と安全を守っていくことが大切だ。太平洋戦争の沖縄戦の犠牲者を悼む「慰霊の日」の２３日、糸満市で全戦没者追悼式が営まれた。７８年前のこの日、旧日本軍の組織的戦闘が終結したとされる。沖縄戦では、日米で２０万人以上が死亡し、このうち９万４０００人もの住民が命を落とした。本土への侵攻を遅らせるため、旧日本軍は、沖縄本島南部に撤退してからも戦いを続行し、多くの住民が戦渦に巻き込まれた。いつの時代も戦争は理不尽に命を奪い、人々の生活を破壊する。犠牲者の無念に思いをはせ、平和への誓いを新たにしたい。岸田首相は式典で、「世界の誰もが平和に暮らせる世の中を実現するため、不断の努力を重ねていく」と語った。沖縄戦と、ウクライナで続く悲劇を重ね合わせ、犠牲者の冥福（めいふく）を祈った人も多いのではないか。沖縄県は那覇市の首里城周辺で、旧日本軍が地下に構築した「司令部壕（ごう）」の調査を進めている。旧軍が爆破し、正確な位置が把握できなかったが、地下の探査で、作戦室などがあった「第１坑道」の場所を特定したという。戦争の苛烈な実相を後世に伝えるため、県は保存や公開を検討してもらいたい。沖縄県を含む南西諸島の安全保障環境は、厳しさを増している。中国は尖閣諸島周辺で領海侵入を常態化させており、台湾周辺では軍事活動を強めている。南西諸島の防衛力の強化は、重要な課題だ。防衛省は、宮古島や石垣島に陸上自衛隊の駐屯地を整備し、ミサイル部隊を配備した。在日米軍と連携し、抑止力を高めていく必要がある。沖縄県の安全を守るには、県の協力が欠かせない。だが、玉城デニー知事は式典で、防衛力強化が「県民に不安を生じさせている」と述べた。沖縄が攻撃目標になりかねないとして、自衛隊が導入する長射程ミサイルの県内配備にも反対している。脅威が存在しないならともかく、現実に脅威が高まっている中で、これに備えるための防衛力強化がかえって緊張を高めるという主張は、理解に苦しむ。もとより、在日米軍施設が沖縄に集中する現状は、早急に是正せねばならない。政府は、普天間飛行場移設など、基地の整理・縮小を着実に進めるべきだ。,2023-06-24 00:00:00,沖縄慰霊の日戦禍を繰り返さぬ誓い新たに,yomiuri
各地で子供のウイルス感染症が急速に広がっている。新型コロナウイルスの感染対策は緩和されたが、引き続き注意する必要がある。東京都は、子供を中心に流行している感染症「ヘルパンギーナ」について、直近の１週間で１医療機関あたりの患者数が６人を超えたとして、警報を出した。２０１９年以来４年ぶりだという。大阪府や滋賀県など各地でも感染が急拡大し、警報レベルに達している。乳幼児がいる家庭や、保育園、幼稚園の運営者らにとっては心配な動向に違いない。ヘルパンギーナは、３８度以上の発熱と、口内にできる水疱（すいほう）が特徴だ。５歳以下の乳幼児がかかることが多い。喉の痛みから食事をいやがる子供が多く、夏季は脱水症状に陥ることがないよう、水分を多めにとることが重要になる。なかなか水分をとれない場合には、アイスクリームやゼリーなどの、冷たく食べやすいものを口にするのも有効だろう。ヘルパンギーナのほかに、発熱や咳（せき）の症状が出る「ＲＳウイルス」も増加しているという。季節外れのインフルエンザも各地で散発しており、学校では集団感染や学級閉鎖などが相次いでいる。ここ３年間は、コロナ対策の感染予防策が、社会全体で徹底されていた。それに伴い、子供がコロナ以外の様々なウイルスにさらされる機会が減り、免疫力が低下したことが急拡大の原因ではないかと専門家は指摘している。新型コロナの感染症法上の位置づけが５類に移行して、人の動きが活発化し、感染が一気に拡大した形だ。感染症全般に共通する対策として、手洗いやうがいといった基本の励行を心がけたい。ヘルパンギーナや手足口病、咽頭結膜熱（プール熱）など、夏に流行する感染症は一般に「夏風邪」と呼ばれる。多くは急な発熱や発疹などの症状がみられる。子供は日常の活動を通じて様々な感染症にかかり、徐々に免疫を獲得していく。コロナ禍の影響で、最近になって、ようやく日常生活を取り戻した子供も多いはずだ。まだ十分な免疫を獲得できていない子供もおり、注意が要る。子供のほか、高齢者も感染すると重症化する例がある。風邪だからと軽視しないことが重要だ。社会はコロナ禍の混乱から回復する途上にある。様々な感染症への警戒を怠らないようにしたい。病院や人の密集する場所ではマスクを着用するなど、適切に感染症と向き合うことが大切だ。,2023-06-24 00:00:00,子供の感染症免疫力低下で急拡大が心配だ,yomiuri
脱炭素へ向け、火力発電所などから出た二酸化炭素（ＣＯ２）を回収して地中に埋める技術への関心が世界で高まっている。日本も事業化を急がねばならない。この技術は「ＣＣＳ」と呼ばれる。特殊な膜や水溶液などを使って、発電所や工場などの排ガスからＣＯ２を分離・回収する。それを船舶やパイプラインで貯留地に運び、１～３キロ・メートル程度の深さの地層にためる。ＣＯ２が漏れないよう、固い地層の下まで穴を掘り、圧縮して封じ込める。日本はＣＯ２の排出を減らそうと、太陽光などの再生可能エネルギーを増やしているが、適地が少ないため急拡大は難しい。当面は天然ガスや石炭による火力発電に頼らざるを得ない。ＣＣＳが広がれば、火力発電を続けやすくなる。鉄鋼などＣＯ２の排出削減が困難な業種は他にもあり、恩恵は大きいと言える。国内では、石油、電力や商社などの日本企業が事業化を計画している。経済産業省は今月、九州沖合や北海道沿岸、首都圏など国内外の７か所の事業を重点的に支援すると発表した。地層を調べる費用などを国が補助する方針だ。経産省は、７か所の事業化で、２０３０年度に日本の年間排出量の１％強となる約１３００万トンのＣＯ２を貯留できると見込む。５０年にＣＯ２排出量を実質ゼロにする国の目標達成には年１・２億～２・４億トンの貯留が必要だとの試算がある。政府は、５０年までに国内の貯留場所を２０～２５か所に増やすとしている。ただ、経産省によると、現状では初期費用が数百億円かかるほか、回収から貯留まで１トンあたり最低でも１万円程度を要する。コストの引き下げが不可欠だ。官民が協力し、ＣＯ２の回収費用を下げる技術開発を進めてほしい。貯留場所の周辺住民や漁業者の理解を得ることも大切だ。経産省は既に北海道の沖合で実証試験を行い、１９年までに３０万トンのＣＯ２貯留に成功した。過去の地震でも漏出しなかったという。ＣＣＳの意義や仕組みを丁寧に説明するとともに、事業者に安全対策の徹底を求め、住民らの不安を軽減することが重要だ。海外では、米国政府が５月、火力発電所に、ＣＣＳの利用などを義務づける新規制案を発表した。米欧や中国など世界で約１５０件のＣＣＳの開発計画があるほか、既に３０件が稼働中だという。政府や事業者は、先行する米欧との連携も強めてもらいたい。,2023-06-23 00:00:00,ＣＯ２地下貯留温暖化防ぐ有効策にできるか,yomiuri
リスクが高い金融商品を巡って、不適切な販売や勧誘をしていた銀行などに、行政処分が下される見通しとなった。銀行の信頼を損なう行為であり、猛省すべきだ。証券取引等監視委員会は、元本割れリスクのある「仕組み債」の販売などに問題があったとして、千葉銀行と子会社のちばぎん証券、武蔵野銀行の３社を行政処分するよう金融庁に勧告した。金融庁は、近く業務改善命令などを出す方針だ。再発防止策の徹底を求めるなど、厳正に対処しなければならない。仕組み債は、デリバティブ（金融派生商品）を組み込んだ複雑な債券で、高い利回りをうたう商品が多い。ただ、株価や為替などの指標に応じて価格が変動し、大きな損失が出る場合もある。金融商品取引法は、顧客の知識や経験、資産状況に合わせて商品の販売や勧誘を行うよう定めている。仕組み債は、リスクを理解できる顧客に限って販売すべき商品であることは明白だ。それにもかかわらず、監視委によると、ちばぎん証券は、銀行側から紹介された顧客の知識や経験を適切に把握せず、仕組み債の販売を長期間、続けていた。これについては多くの苦情が寄せられ、証券会社の団体から３度も注意喚起を受けていた。しかし、ちばぎん証券は多くの苦情に「一方的申し出だ」などと対応しなかった。顧客軽視が目に余る。千葉銀と、提携関係にある武蔵野銀も、「安全に運用し、小遣いが稼げる」などと、勧誘をしていた。紹介した顧客が仕組み債を購入すれば、行員の営業成績に反映されるためだという。預金を集める銀行は信頼が第一だ。千葉銀は地銀の中でもトップクラスの規模で、頭取は今月まで全国地方銀行協会の会長を務めていただけに、責任は重い。問題は、この３社にとどまらないとみられる。金融庁によると、２０２２年３月末時点で約８割の地銀が仕組み債を扱っていた。金融商品の苦情を受け付けるＮＰＯ法人には、「よくわからないまま約３６００万円の損害を被った」「安全な運用を望んで退職金を投じたのに約２３００万円の損害が出た」などの声があった。超低金利で利ざやによる収入が細った銀行が、仕組み債を新たな収益源と考えたという。現在は販売を停止した銀行が多いが、金融庁は金融業界全体の問題と捉え、「顧客本位」の営業姿勢を再び徹底させることが不可欠だ。,2023-06-23 00:00:00,千葉銀処分勧告信頼損なう「仕組み債」の販売,yomiuri
学校は学びの場であるだけでなく、災害時は住民の避難所にもなる。大地震に加え、近年多発している豪雨に対しても、実効性のある安全対策を急ぐべきだ。全国の公立小中学校などの９割以上は、自治体から災害時の避難所に指定されており、地域の防災対策で重要な役割を担っている。学校施設が災害に脆弱（ぜいじゃく）であれば、児童や生徒のみならず、地域住民の安全も守れない。国や自治体はこれまで学校の耐震化工事に重点的に予算を注ぎ、耐震化率はほぼ１００％に達した。一方で、豪雨災害への備えが後回しになったのは否めない。浸水想定区域内にある公立学校は、２０２０年１０月時点で全体の約２割に相当する７４７６校に上るが、このうち対策を施しているのは約１５％にとどまっている。浸水想定区域は「１０００年に１度」とされる大規模水害が前提となっているため、校舎の移転やかさ上げなどの工事は当面急がなくてもよいと考えられがちだ。しかし、こうした長期的な想定とは別に、毎年のように豪雨災害が起きている以上、できることから対策を始め、被害を最小限にとどめる必要がある。１９年１０月の台風１９号では、東日本を中心に２１７０校が被害を受け、２９４校が休校した。復旧に１年間を要したり、間借り施設での授業を強いられたりする事例が相次いだ。屋外にある電気設備が水につかって校舎が停電し、休校に追い込まれるケースは多い。文部科学省は、５月に公表した手引で、こうした事態を防ぐ対策を優先して検討するよう促した。台風１９号で被災した栃木県の高校は、復旧工事に合わせて、電気設備の位置を２メートル近くかさ上げした。成績表や試験の答案などの重要書類を守るため、職員室も１階から２階に移したという。参考にすべき事例ではないか。豪雨が頻発する季節を迎え、各自治体や学校は何を優先すべきかを改めて点検し、対策の実効性を高めてもらいたい。大雨や洪水の気象警報が出た時に、学校を休校にするのか。授業の有無にかかわらず避難所として利用するのか。保護者や住民にこうした情報が的確に伝わらなければ、無用な混乱を招きかねない。学校や自治体は、休校や避難所開設などの基準を盛り込んだマニュアルの整備や避難訓練を通じ、備えを徹底することが大切だ。,2023-06-22 00:00:00,学校の防災対策豪雨への備えも抜かりなく,yomiuri
一部の野党の協力を得て法案成立が順調に進んだからといって、政府・与党が様々な政策課題について、真剣な論戦を軽視するようでは困る。通常国会が閉会した。政府が提出していた６１本の法案のうち、５９本が成立した。このうち防衛財源確保法は、安全保障環境の悪化を踏まえ、税外収入を積み立てて防衛費の増額分に充てる内容だ。原子力発電所の運転期間の延長を柱とした関連法は、脱炭素と電力の安定供給という課題に対処する狙いがある。いずれも日本が直面している懸案の解決を目指したものであり、法制化の意義は大きい。強制送還の対象となった外国人の処遇を見直す改正出入国管理・難民認定法は、自民、公明両党と、日本維新の会、国民民主党がまとめた修正案が成立した。より良い制度とするため、与野党が協力して合意を形成したことは評価できる。一方、重要課題に関する政府・与党の姿勢には疑問も残った。性的少数者（ＬＧＢＴ）への理解増進法の委員会審議は、衆参両院ともわずか１日で、いずれも３時間前後で終わった。曖昧な表現が多く、内容に問題があるにもかかわらず、自民党の法案提出者から明確な説明はなかった。このままでは、悪意ある男性が「私は女性だ」と主張して女性専用のスペースを利用するといった事態を助長しかねない。「社会が変わる」ほどの法案を拙速に成立させたことは、将来に禍根を残す恐れが大きい。来年秋に健康保険証を廃止し、マイナンバーカードに一本化する施策は、関連法が成立したが、２年前からトラブルが多発していたことが判明した。患者が医療機関で「マイナ保険証」を示しても、無効とされる事例もあった。野党に限らず、公明党からも「無理やりやることはない」と慎重論が出ているのに、岸田首相は、保険証の廃止方針は変えないと強調している。首相の「聞く力」はどこに行ったのか。今国会では、立法府の権威を揺るがすような事態も相次いだ。昨年の参院選後、海外に滞在したまま一度も登院しなかった参院議員は除名され、動画投稿サイトで著名人を脅迫した容疑で逮捕された。また、法案採決を力ずくで阻もうとして、議員２人にけがをさせた参院議員もいた。国権の最高機関を貶（おとし）める振る舞いは許されない。各党は、規律を徹底する必要がある。,2023-06-22 00:00:00,通常国会閉会論戦が深まったとは言い難い,yomiuri
