Content,Date,Title,Newspaper
「過ちは繰返しませぬから」。広島の原爆死没者慰霊碑に刻まれたこの誓いを守り抜く覚悟が、花を手向けた各国リーダーにこれほどまで切実に問われたことはあるまい。それは、今起きている戦争を止めるため、未来に核の惨禍を起こさないため、包摂と対話の国際秩序を築く責任でもある。■多様な国と関係築けグローバル化し、ますます複雑化する世界にあって、国境を越えて対処しなくてはならない課題は山積している。きのうまで広島で開催された主要７カ国首脳会議（Ｇ７サミット）では、ウクライナ情勢や核軍縮など世界の安全に関わる問題はもちろん、気候変動や人工知能、国際保健やジェンダーといった人々の生活に直接影響する分野まで、実に多くの議題が俎上（そじょう）にのぼった。だが何よりも深刻なのは、秩序の守り手たるべき大国ロシアが始めた違法な戦争を、止める有効な手立てをとれない国際社会の現実だ。国連安全保障理事会は、常任理事国ロシアの拒否権で機能不全に陥っている。新興国も加わるＧ２０もロシアの反対で一致した方向性を示せる状況にはない。であればこそ、自由や民主主義などの価値観を共有するＧ７の責務は重い。ロシアの違法な侵攻が続く限り「ウクライナを支援する」と首脳声明で言明したのは当然だ。だが、もう一つ、世界が直面する試練がある。Ｇ７だけで解決策を見いだすには、もはや限界があるという現実だ。主要国サミットが始まってほぼ半世紀。かつて世界の６割を占めたＧ７の国内総生産（ＧＤＰ）は今は４割となり、影響力の低下は覆い隠せない。このため広島サミットでは、「グローバルサウス」と呼ばれる新興国や途上国との関係づくりに力点が置かれた。多様な国々のリーダーを招待し、サミット期間のほぼ半分を彼らを交えた議論に割いた。その成果はまだ見通せないが、今後のＧ７の方向性を示したとはいえる。ただし、陣営を分け、「どちらにつくか」と迫る手法では新興国・途上国の信用は得られまい。彼らの声に真摯（しんし）に耳を傾け、Ｇ７が自らの利害を超えて共通課題に本気で取り組む姿勢が必要だ。■非核の道筋示されずロシアが核の脅しを繰り返し、核戦争が現実味をもって語られる今こそ、被爆の惨禍を発信してきた広島でサミットを開く意味があったのは、いうまでもない。核保有国とその傘下の国の首脳が慰霊碑にこうべを垂れ、十分とはいえなくとも被爆の実相に触れた意義はある。だが、「核なき世界」の理想に向けて現実を近づける具体的な筋道は提示されなかった。首脳声明では「現実的で実践的なアプローチ」の名のもとに、核抑止の維持が正当化された。今まさに核の脅威下にあるウクライナのゼレンスキー大統領もサミットに参加した。Ｇ７がウクライナ支援で結束を固め直す機会になっただけでなく、国益重視の立場から対ロ制裁に加わってこなかったインドのモディ首相と会談するなど、Ｇ７以外の国々と直接意見を交わす場にもなった。一方、ゼレンスキー氏の訪日に先立ち、バイデン政権が米国製戦闘機をウクライナに提供することを認める方針を広島で発表するなど、対ロ反攻を前に軍事面での支援に注目が集まった感も否めない。戦争終結への道筋など大局に立った議論が聞かれなかったのは理解に苦しむ。■日本は真の橋渡しをサミットの陰の主役は中国だったといえるだろう。東・南シナ海や台湾をめぐる情勢、人権問題から、豊富な資源を武器に他国に圧力をかける経済的威圧まで、首脳声明の多くが中国への懸念表明に割かれた。だが、最大の問題はＧ７の枠組みで中国と対話するチャンネルがないことだ。その意味で対抗一辺倒ではなく、「建設的、安定的な関係の構築」が首脳声明に盛り込まれ、気候変動など共通の関心分野で中国との協働がうたわれたのは光明だ。中国との対話を深めるＧ７の一層の努力が欠かせないが、中国も国際秩序を共に構築する責任を自覚する必要がある。岸田首相は今回のサミットのねらいを、「国際社会を分断と対立ではなく、協調に導く」と繰り返してきた。もはやＧ７だけで問題は解決できないことが明らかになった以上、日本はアジア唯一のＧ７メンバー国として、主要国と新興国・途上国、さらに中国を結びつける役割に、より本気で取り組むべきだ。国連やＧ２０など、きしみが目立つ国際社会の枠組みを再生する努力に、より主導的に関与しなければならない。首相が最も力を入れたとする「核なき世界」への取り組みでも、今回、世界の関心を広島に向けさせた「実績」に安住してはならない。すべてが緒についたばかり、と自覚すべきだ。,2023-05-21 20:00:00+00:00,広島サミット閉幕　包摂の秩序構築につなげよ,asahi
「デジタル円」の議論が本格化してきた。中央銀行が発行するデジタル通貨の検討は海外でも進んでおり、正式に導入した国もある。日本でも、経済や社会の変化に応じて通貨や決済のあり方を考えるべきときだろう。広く国民にかかわるテーマだけに、開かれたかたちで議論を深める必要がある。財務省は先月、制度設計の大枠を整理するための有識者会議を立ち上げた。年内をめどに論点をまとめる。日本銀行は「現時点で発行する計画はない」としつつ、一昨年春に実証実験を始めた。先月からは、個人のスマートフォンや店舗の端末での決済を想定した「パイロット実験」の段階に入っている。日本では現金の流通が今も増える傾向にあるが、取り扱いにかかるコストは無視できない。金融機関ではＡＴＭ削減などの動きが強まっている。ここ数年は、民間企業による電子マネーなど現金を用いない決済も広がっているが、課題も多い。顧客を囲い込む競争の結果、店舗によって使えるサービスが異なったり、サービス間での送金が難しかったりすることがある。一方で、いったん普及の度合いに差がつきだすと、利用者が多いサービスほど有利になる特性があるため、「勝者総取り」になりやすい。その場合、経済の基本的機能を、少数の民間企業が独占することによる弊害も懸念される。中央銀行によるデジタル円の発行は、こうした課題への解の一つになりうる。経済のインフラである決済システムの安定性や効率性の向上にもつながるかもしれない。ただ、金融システムの安定や金融政策の運営に悪影響を与えるようでは、本末転倒だ。例えば、金融不安が広がった時に、現金よりも「取り付け」が起きやすくならないか。最近の米国の銀行破綻（はたん）は、ＳＮＳによる情報拡散とネットバンキングを通じた預金流出の拡大が一因とされる。デジタル円に資金が逃げ、事態を悪化させる可能性は否定できない。取り付けには至らなくても、預金からのシフトが大きく進めば、信用創造を担う銀行が弱体化し、経済活動の足を引っ張る恐れもある。日銀の検討では、保有や取引の額に上限を設けることが選択肢に挙がるが、慎重な制度設計が求められる。利用者のプライバシー保護の徹底といった大前提にすべき課題もある。財務省や日銀は議論の出発点として、デジタル円の利点や課題をわかりやすく示さなければならない。国民の理解や支持を欠いたままでは、到底「通貨」たりえないからだ。,2023-05-20 20:00:00+00:00,デジタル円　国民に開かれた議論を,asahi
核兵器の保有国を含む主要７カ国（Ｇ７）の首脳が被爆地・広島に集い、被爆の実相に触れた。感じたことを、そして核廃絶への明確な理念と決意を語ってほしい――。そうした広島・長崎の思いに応えたとは、とても言えない。各国首脳がおととい、広島平和記念資料館を訪れ、「核軍縮に関する広島ビジョン」を発表した。Ｇ７首脳会議（サミット）としては初めての、核問題に焦点を当てた文書である。目につくのは、米英仏の核保有国と、日本などその傘下にある４カ国の結束ぶりを印象づけようとする姿勢だ。文書は、ウクライナ侵略に伴うロシアによる核の脅しや中国の核戦力増強、北朝鮮の核・ミサイル開発などへの懸念を列記し、安全保障環境の厳しさを指摘した。核兵器の存在理由として「防衛目的、侵略抑止、戦争防止」を挙げ、核抑止政策の重要性をうたった。「核兵器のない世界という究極の目標」といった記述はあるものの、具体的な道のりは示せていない。「現実的、実践的なアプローチ」を強調するばかりで、発効済みの核兵器禁止条約にも全く触れなかった。核廃絶への長期的な視点を欠く文書は、被爆地の名を冠したビジョンと呼ぶに値しない。首脳らは資料館で被爆資料に触れ、被爆者の証言を聞いた。ところが訪問はすべて非公開だった。何を見聞きしてどう受け止めたのか、首脳らの肉声はおろか、説明すらほとんどないままだ。原爆を投下した米国の、バイデン大統領への配慮などが理由とみられる。ただ、どの首脳も、核兵器がもたらす破滅と人間の辛苦の一端に触れ、感じることがあったのだろう。芳名録に率直な思いを記した。「この資料館で語られる物語が、平和な未来を築くことへの私たち全員の義務を思い出させてくれますように」（バイデン氏）。「平和のために行動することだけが、私たちに課せられた使命です」（マクロン仏大統領）。「私たちが、心と魂を込めて言えることは、繰り返さないということだ」（スナク英首相）その思いを首脳たちは自らの言葉で語り、被爆地の、そして世界の市民社会に伝えてほしい。それが「核のない世界」への一歩となるはずだ。Ｇ７サミットでは最終日のきょう、ベトナムなど核禁止条約の参加国を含む招待８カ国の首脳らが資料館を訪れる。核廃絶への思いを広く共有し、確かなメッセージを世界へ発せられるか。議長の岸田首相の手腕が問われる。,2023-05-20 20:00:00+00:00,Ｇ７と核廃絶　被爆地の訴えに応えよ,asahi
筆舌に尽くせぬ原爆の歴史にこうべを垂れ、いま起きている凄惨（せいさん）な戦争の出口を探り、今後の世界秩序を考える。半世紀近い主要国サミットの歩みのなかで、今回ほど重大な使命が課せられた会合は異例である。Ｇ７首脳会議がきのう広島で始まった。経済、安保、食料、保健など世界が直面する幅広い分野を２１日まで話しあう。まず問われるのは、歴史の教訓を現在の世界にどう生かすかだ。被爆地の証言を原点に、紛争を平和的に解決し、核戦争の破局を防がねばならない。各首脳らは広島平和記念資料館（原爆資料館）を訪れ、約４０分間を過ごした。案内役を務めた松井一実・広島市長によると、全員「神妙な表情」だったというが、何を思い、考えたのか。首脳らの肉声を聞きたい。とりわけ原爆を投下した米国のバイデン大統領には、ぜひとも自らの言葉で語ってもらいたい。各国とも、この広島で見聞した惨状は決して過去のものとは言い切れぬ現実こそを直視すべきである。いままさにその脅威にさらされているウクライナのゼレンスキー大統領も、来日による対面参加が調整されているという。大戦後の欧州で起きた最大規模の紛争の当事国であり、Ｇ７が自らの足元の戦禍に苦悩するのも異例のことだ。きのう発表した首脳声明は、ウクライナへの軍事面を含む支援の継続やロシアへの制裁強化などを約束した。「即時、完全かつ無条件の撤退」を求めるなかで、頻繁に言及されているのは「第三国」の存在である。声明はロシアに協力する国への懲罰を示唆する一方、戦争の余波で食糧難などに苦しむ国々との連帯を強調している。ここに、今回のＧ７が迫られたもう一つの課題が見える。「グローバルサウス」と呼ばれる新興・途上国との関係づくりだ。ロシアの侵略を国際法違反とみる国は多いが、Ｇ７が発動した制裁に加わるのは限定的で、今回の招待国インドやブラジルなども同様だ。各地の紛争や貧困などにあえぐ国々の多くは、Ｇ７対ロシア・中国という対立軸に冷めた目を向けている。Ｇ７はこれまでも途上国の重債務問題や開発支援などで関与をうたってきたが、ウクライナ戦争で学ぶべき教訓は、法の支配による国際秩序を築くうえでも新興・途上国の協力が欠かせないことであろう。Ｇ７は今回の招待国との対話で謙虚に耳を傾けるべきだ。中ロを含む少数の大国が、世界を破滅させるほどの強大な核戦力を抱え、覇を競うことがいかに愚かなことか。広島の地で、その自省をすべきではないか。,2023-05-19 20:00:00+00:00,広島サミット　歴史の教訓　今に生かせ,asahi
事実に基づかない国会での発言は撤回し、謝罪すべきだ。出入国管理法改正案を巡る国会審議で、日本維新の会の梅村みずほ参院議員が、入管施設で死亡した被収容者について根拠のない発言を繰り返している。２年前のウィシュマ・サンダマリさんの死は、収容の長期化や乏しい医療態勢など、入管の課題を広く提起した。そのウィシュマさんについて、梅村氏は先週の参院本会議の代表質問で「支援者の一言が『病気になれば仮釈放してもらえる』という淡い期待を抱かせ、医師から詐病の可能性を指摘される状況へつながったおそれも否定できない」と発言した。遺族の弁護団が根拠をただすと、１６日の参院法務委員会では「事実はない。しかし可能性は否定できない」と繰り返し、ハンガーストライキによる死去の可能性にも言及した。入管当局は詐病ともハンストとも認めていない。「可能性」という言葉にくるみ根拠に欠ける独自の見解を展開するのは、議場での発言に伴う責任を忘れた行為だ。きのう、梅村氏は国会議員の議場での発言は国会外では免責されるとの憲法の規定を挙げ、「何のための免責特権か。タブーに切り込むためだ」とも述べた。特権を振りかざして根拠なく他者を傷つけることが道義的に許されるはずはない。窮地の外国人を支える人々をおとしめる発言でもある。ウィシュマさんの死を巡る入管の最終報告書には、精神科医が入管職員の説明をふまえ「一つの可能性として詐病を考えた」との記述はあるが、支援者が促したとの記載はない。外国人の収容のあり方を見直すべき法案審議の場で、殊更に外国人や支援者を責めようとする意図は理解しがたい。党の責任も極めて重い。維新はきのう、梅村氏を法務委の委員から外し、党としての処分を後日決める方針を発表した。藤田文武幹事長は「思い込みや想像で感情的な質疑をしたことは極めて不適切」と述べた。しかしここに至るまでの対応は鈍く、梅村氏が国会で人を傷つける発言を繰り返すのを許した。処分も厳しい批判に押されてのことだろう。事態を真摯（しんし）に受け止めていたとは言い難い。本会議での質問は党を代表したものであり、党の政策部門が内容を最終チェックしていたという。音喜多駿政調会長は一昨日、「問題提起として間違ったことをしたとは思っていない」と述べており、党も理解していたと見られても仕方ない。維新は次の衆院選では野党第１党をめざすという。人権感覚への疑念を払拭（ふっしょく）できなければ、その資格はないと心すべきだ。,2023-05-18 20:00:00+00:00,維新・梅村議員　根拠のない発言　撤回を,asahi
企業の好決算と株高が続いている。コロナ禍で停滞していた経済活動が上向いたことは歓迎したいが、株主への利益の還元が増す一方で、賃上げはなお物足りない。個人消費に支えられた持続的成長を実現するためにも、企業は働き手に報いる姿勢を強めるべきだ。２０２３年３月期の決算で、東京証券取引所の旧１部上場企業の純利益は過去最高水準になる見通しだ。２４年３月期も好業績が続く見込みという。鉄道や航空の客足が戻り、ＪＲの本州３社や航空大手は黒字に転じた。資源高は電力大手の赤字を招いたが、商社には追い風になり、三菱商事と三井物産は純利益が初めて１兆円を超えた。円安も海外事業のもうけを膨らませ、自動車大手は７社中５社が増益だった。日本の景気回復が海外投資家もひきつけ、株価を押し上げているのであれば、望ましい動きといえる。ただ留意すべきは、このところ企業側が増配や自社株買いなどの株主還元に力を入れ、それを材料に株が買われる構図が目につくことだ。東証は３月に、株式の時価総額が正味の資産価値を下回るような企業を念頭に、経営の改善を促した。これ以降、株主還元を打ち出す企業が増えている。好決算が続いて利益が積み上がっているのに、それを有効活用できていない企業が目立つのは確かに問題だ。株主に資金を返すべき場合もあるだろう。だが、手っ取り早い改善策として自社株買いに走っても、効果は一時的だ。それに支えられた株高なら、持続性には疑問符がつく。東証の要請も「一過性の対応を期待するものではない」とクギを刺している。本来目指すべきは、資金を有効に用いて企業の将来性への期待を高め、その結果として株価も上がっていく姿だろう。企業の成長に欠かせないのは、人材育成も含めた前向きな投資と、働き手に報いる賃上げだ。今春闘では一定の賃上げが達成されたが、足もとの物価高を補い切れていない。家計の収入が目減りして購買力が落ちれば、企業自らの首を絞めることにもつながる。逆に、いっそうの賃上げで個人消費が厚みを増せば、それこそが企業の持続的な成長の糧になる。好調な業績見通しを踏まえれば、多くの企業に余力はあるはずだ。海外では、インフレ抑制のための急速な利上げで景気の減速感が強まっている。米国の銀行破綻（はたん）で金融不安もくすぶる。海外景気の悪化に備えるためにも、内需の安定が不可欠だ。,2023-05-18 20:00:00+00:00,好業績と株価　賃上げ持続につなげよ,asahi
人工妊娠中絶のための飲み薬が、国内で初めて実用化されることになった。望まない妊娠と中絶は、女性の心と体に大きな負担を与えるものだ。それを軽減する選択肢として、当事者が安心して利用できるよう、政府や医療関係者は工夫をこらしてほしい。２１年度の人工妊娠中絶は約１２万６千件。子宮内を器具でかきだす掻爬（そうは）法、器具で吸い出す吸引法が用いられてきた。しかし、世界保健機関（ＷＨＯ）は経口中絶薬と吸引法を「安全で効果的な方法」として推奨する一方、子宮を傷つけるおそれのある掻爬法は「廃れた方法」として置き換えを促して久しい。海外では１９８０年代以降、経口薬の使用が広がり、８０以上の国・地域で用いられているが、日本での導入は遅れた。今回承認された中絶薬は妊娠初期が対象で、英国の製薬会社が２１年１２月に承認申請していた。２種類の薬を３６～４８時間空けて服用するもので、国内の治験では２４時間以内に９３％が中絶に至った。中絶薬が各国で普及した背景には、高い安全性や効果に加え、手術や入院を必要とせず自己管理でき、プライバシーが保護される点にあるといわれている。コロナ禍でオンライン診療と郵送による処方も広がった。初導入となる日本では、当面の間、入院施設のある医療機関が処方する。高い安全性が認められているとはいえ、医師が経過を確かめ、知見を共有することは、薬を定着させていくうえで必要なプロセスだろう。ただし、本来、入院を伴わずに処方されている薬であり、一定期間後の再検討は不可欠だ。中絶は自由診療で、この薬自体は高価ではないものの、費用は医療機関しだいという。従来の中絶より負担を軽くする配慮も求めたい。手術だけを前提にしてきた現行の母体保護法指定医のしくみも、包括的に見直すことが必要になってくる。方法の選択肢が広がっても、中絶をめぐる状況には課題が残っている。形骸化しているとはいえ刑法には堕胎罪があり、中絶を罪悪視することにつながっている。女性自らによる堕胎は対象から外すべきだ。また、母体保護法には中絶に本人だけでなく配偶者の同意を求める規定があるが、女性が妊娠・出産について自ら決める権利を尊重することとの矛盾が大きい。夫との関係が破綻（はたん）している場合は本人の同意で足るとするなど運用は見直されてきたとはいえ、規定自体をなくすべきだ。国際ＮＧＯによると同様の規定があるのは、中東など約１０の国・地域にとどまる。,2023-05-17 20:00:00+00:00,飲む中絶薬　負担の軽減につなげよ,asahi
